Year,Event,Effect on the Market
1985,"Plaza Accord signed, bubble started",Upward Trend (Nikkei doubles in ~ 2 yrs)
1990,Bubble burst,Downward Trend (Nikkei drops by ~40%)
1997,Asian Financial Crisis / Japanese banking crisis,Downward Trend
2008,Global Financial Crisis,Downward Trend
2011,Great East Japan Earthquake,Downward Trend
2013,Start of Abenomics by Shinzo Abe,Upward Trend
2020,COVID-19 Pandemic,Sharp Downward -> Strong Rebound (Upward)
2025,Sanae Takaichi got elected as PM,Upward Trend